<?xml version="1.0" encoding="UTF-8"?>
<root xmlns:xsi="http://www.w3.org/2001/XMLSchema-instance" xsi:noNamespaceSchemaLocation="Schema.xsd">
	<first/>
	<second/>
	<unlimited/>
	<unlimited value="1"/>
	<unlimited value="2">
		<nested/>
	</unlimited>
	<unlimited value="3">text</unlimited>
</root>
